{
  "schema_id": "https://t-understand.dev/schemas/software-bill-of-materials.schema.json",
  "schema_version": "1.0.0",
  "name": "t-understand",
  "version": "1.0.2",
  "files": [
    {
      "path": "AGENTS.md",
      "sha256": "042fbd05de7ea122dc97ea23352c3330521ac861177c466438f6af7b8dcc662f",
      "size": 16173
    },
    {
      "path": "MANIFEST.md",
      "sha256": "99ff2989f6aa29e9b2dbd2ac0aaecfbab7a0e1a6ace4175477607bf53c4de34b",
      "size": 1764
    },
    {
      "path": "Makefile",
      "sha256": "b8abffb7e6d4fb600f256576a225b30f3762c6d52ed04649e775ccbd377f61a9",
      "size": 10988
    },
    {
      "path": "PHASE-STATUS.md",
      "sha256": "b75174bc71c060fc4085016251db268d93e97899ce44cf34e6ca20103cc8b9ea",
      "size": 1651
    },
    {
      "path": "README.md",
      "sha256": "b939792c72672c0d120d16656c93d597dc030f9e4ecb1f249e8a2c6d1576a21f",
      "size": 5953
    },
    {
      "path": "RELEASE-NOTES.md",
      "sha256": "c60ab48503bd69579b529bb3f5a53af796ac3e7af6eb8f0d4c021e3ecdeec3a0",
      "size": 1560
    },
    {
      "path": "VERSION",
      "sha256": "9fd28642d3aca191e5c7fc2383cfd6fabb2aac8743f029dabb8989ac584e31bc",
      "size": 6
    },
    {
      "path": "adapters/claude-code/CLAUDE.md",
      "sha256": "035bc98cca256cf4637e1f70d6d27ebc9c3a2b3a44703ade371357d08a1b1db3",
      "size": 1058
    },
    {
      "path": "adapters/claude-code/adapter.yaml",
      "sha256": "5fd8649660e7ee57924740b21688bd6f4a39a7e2a6d2a8dbf1c7b833185f546c",
      "size": 364
    },
    {
      "path": "adapters/codex/TU-UNDERSTAND.md",
      "sha256": "603c031667e17174e1e9da59591e0f5ef6048af39ae8e6c8ed3966225d937097",
      "size": 933
    },
    {
      "path": "adapters/codex/adapter.yaml",
      "sha256": "420553d07f964fc12c4f429c80bc35db164769b34d37caa0cbcc5b4197b9cfb6",
      "size": 405
    },
    {
      "path": "adapters/codex/tu-understand/SKILL.md",
      "sha256": "3bca6ee947f5c6452b772fca947b27c75343cde3d93d2a8d72f313dc39515b3c",
      "size": 1712
    },
    {
      "path": "adapters/codex/tu-understand/references/agents/t-understand.md",
      "sha256": "26e755e3c3db63ae6c3ee1e5d29be761ea6d622705c3974a652644294fe622ab",
      "size": 887
    },
    {
      "path": "adapters/codex/tu-understand/references/agents/tu-analyzer.md",
      "sha256": "e72f3635b7003cb2cd40ca3ca3c72e0e9a3a9523cc98ca147a9535e0419fce32",
      "size": 766
    },
    {
      "path": "adapters/codex/tu-understand/references/agents/tu-answerer.md",
      "sha256": "b3698c4d6d9b466793aca8b26d336f764b010369935c6249b52c30c94d381f45",
      "size": 757
    },
    {
      "path": "adapters/codex/tu-understand/references/agents/tu-business-writer.md",
      "sha256": "5955d1da9532c45e9f6ca985769e564482e0e9d830e856647012ef2a1943659e",
      "size": 794
    },
    {
      "path": "adapters/codex/tu-understand/references/agents/tu-critic.md",
      "sha256": "3ddf9847a3ce026214358ce70a9e33ae6afb7d981bc424dacfe673a5dd19927f",
      "size": 730
    },
    {
      "path": "adapters/codex/tu-understand/references/agents/tu-discoverer.md",
      "sha256": "2025fc9f43f99e2b37569019825fc0751857c1f0a66c13a5115d87aebaa6e102",
      "size": 802
    },
    {
      "path": "adapters/codex/tu-understand/references/agents/tu-memory-curator.md",
      "sha256": "0dc3aafa010b0f12cfe719f6e1be605f032ccd906f4921b01fb265ee2f271b63",
      "size": 827
    },
    {
      "path": "adapters/codex/tu-understand/references/agents/tu-modeler.md",
      "sha256": "7391f03a83fb003afa65f6072fd78df7d5f933ea8721d32f0e6132b7457087d1",
      "size": 749
    },
    {
      "path": "adapters/codex/tu-understand/references/agents/tu-reviewer.md",
      "sha256": "66d77ddd970bb89b341af48501fcaa13db7c7b35b5078450662526c9b0048f88",
      "size": 817
    },
    {
      "path": "adapters/codex/tu-understand/references/agents/tu-technical-writer.md",
      "sha256": "04ba510c98b6a7b6be717e990eb4cc46116a44ea06f918aaa09921c39c20f650",
      "size": 768
    },
    {
      "path": "adapters/codex/tu-understand/references/agents/tu-verifier.md",
      "sha256": "b3ef7800b9c580941e6fc916f69d5b82e5117459d6035782dbe202354190b1fe",
      "size": 788
    },
    {
      "path": "adapters/cursor/adapter.yaml",
      "sha256": "99d01f52e33f751981c19ba967af8e6506425cb29e1c739af3a5022743b38533",
      "size": 580
    },
    {
      "path": "adapters/cursor/t-understand.mdc",
      "sha256": "79d4426dda8c0f853240a69b7450f1013aff2e5fa1f9d72b18ff0349f74534a6",
      "size": 1081
    },
    {
      "path": "adapters/opencode/AGENTS.md",
      "sha256": "90abe5da50dc44cc2e2f525fcb7879bbeaf2ee3fb48447106bb12ef39e7e312f",
      "size": 1002
    },
    {
      "path": "adapters/opencode/adapter.yaml",
      "sha256": "ce3226bfe620c481352ded4bf62842026db3b9975fb65db3d7fbf97c32bca1e1",
      "size": 362
    },
    {
      "path": "agents/t-understand/AGENT.md",
      "sha256": "f1930198bff0d478f145eb7035ca1f3e3618ba43d3ffb7ac378504d36130f418",
      "size": 3092
    },
    {
      "path": "agents/t-understand/agent.yaml",
      "sha256": "5bd4ef64340b0a3033ff0ca9802a39d6233dc00d95eb18d0e886161101b218f3",
      "size": 750
    },
    {
      "path": "agents/tu-analyzer/AGENT.md",
      "sha256": "e72f3635b7003cb2cd40ca3ca3c72e0e9a3a9523cc98ca147a9535e0419fce32",
      "size": 766
    },
    {
      "path": "agents/tu-analyzer/agent.yaml",
      "sha256": "c60c6c9100a5bee2165194a17e1a943e5b31b1d3892a21c26621a004cbb00304",
      "size": 622
    },
    {
      "path": "agents/tu-answerer/AGENT.md",
      "sha256": "b3698c4d6d9b466793aca8b26d336f764b010369935c6249b52c30c94d381f45",
      "size": 757
    },
    {
      "path": "agents/tu-answerer/agent.yaml",
      "sha256": "69f6e24e42c4fb3bf6fa0aed220c4fb803dfaf368e3eb7827e99a809346e57bc",
      "size": 615
    },
    {
      "path": "agents/tu-business-writer/AGENT.md",
      "sha256": "5955d1da9532c45e9f6ca985769e564482e0e9d830e856647012ef2a1943659e",
      "size": 794
    },
    {
      "path": "agents/tu-business-writer/agent.yaml",
      "sha256": "4f873f7d07993d5aefc28a55b65951a40f3db7def75aeb7ada6391913ea47649",
      "size": 650
    },
    {
      "path": "agents/tu-critic/AGENT.md",
      "sha256": "3ddf9847a3ce026214358ce70a9e33ae6afb7d981bc424dacfe673a5dd19927f",
      "size": 730
    },
    {
      "path": "agents/tu-critic/agent.yaml",
      "sha256": "49e97d3772cb405f8744515671de84cd084078cd5a0d01c86e55fe1118b30af5",
      "size": 589
    },
    {
      "path": "agents/tu-discoverer/AGENT.md",
      "sha256": "2025fc9f43f99e2b37569019825fc0751857c1f0a66c13a5115d87aebaa6e102",
      "size": 802
    },
    {
      "path": "agents/tu-discoverer/agent.yaml",
      "sha256": "6bf9b8fecf600a98f6632c9c5359d210c1d0cd56ce27c4eae393efe826b22184",
      "size": 664
    },
    {
      "path": "agents/tu-memory-curator/AGENT.md",
      "sha256": "0dc3aafa010b0f12cfe719f6e1be605f032ccd906f4921b01fb265ee2f271b63",
      "size": 827
    },
    {
      "path": "agents/tu-memory-curator/agent.yaml",
      "sha256": "5e9622e51902281633aec7fbdb74138f49b81a264f1669223ebcc10eb274eb8f",
      "size": 682
    },
    {
      "path": "agents/tu-modeler/AGENT.md",
      "sha256": "7391f03a83fb003afa65f6072fd78df7d5f933ea8721d32f0e6132b7457087d1",
      "size": 749
    },
    {
      "path": "agents/tu-modeler/agent.yaml",
      "sha256": "88bc1211d68f9aa6325fbbe598b250e86cc9b17972149d65339a5140bea0c26b",
      "size": 604
    },
    {
      "path": "agents/tu-reviewer/AGENT.md",
      "sha256": "66d77ddd970bb89b341af48501fcaa13db7c7b35b5078450662526c9b0048f88",
      "size": 817
    },
    {
      "path": "agents/tu-reviewer/agent.yaml",
      "sha256": "4febd9279250af9b4ca633fb2120cfc218a63820d6bfc4126352b9b7711d902e",
      "size": 671
    },
    {
      "path": "agents/tu-technical-writer/AGENT.md",
      "sha256": "04ba510c98b6a7b6be717e990eb4cc46116a44ea06f918aaa09921c39c20f650",
      "size": 768
    },
    {
      "path": "agents/tu-technical-writer/agent.yaml",
      "sha256": "938704784cd8a520e294aabbc6387ca10674772324d250b565c1835bd28c81a4",
      "size": 625
    },
    {
      "path": "agents/tu-verifier/AGENT.md",
      "sha256": "b3ef7800b9c580941e6fc916f69d5b82e5117459d6035782dbe202354190b1fe",
      "size": 788
    },
    {
      "path": "agents/tu-verifier/agent.yaml",
      "sha256": "f6d7c9c71ccbbaaf8efaa03caad75ff71de130a17017c30e150ad17213d9d0ef",
      "size": 646
    },
    {
      "path": "bin/doctor.ps1",
      "sha256": "5662596ad411f45d796067e9328b7fa8c4608bc5f48ac2b297a3d2b6f713fea6",
      "size": 1084
    },
    {
      "path": "bin/doctor.sh",
      "sha256": "af75a7217456d0fa49c1ce155a0bc0d3564f69ec341658db190705c68f36bf00",
      "size": 662
    },
    {
      "path": "bin/install.ps1",
      "sha256": "9ed3f1a6ae83b67ceb34e646a279b6ec18ada8696e7e5e93bbd1569bdd0dd3e4",
      "size": 1150
    },
    {
      "path": "bin/install.sh",
      "sha256": "4f2ec12070c84ac214c27776b4ad694536d619b58f2f1e952dbdbabb37bc4276",
      "size": 754
    },
    {
      "path": "bin/t-understand",
      "sha256": "ef8beadf549ff6e4715d620be2b2ab9e7211610c591ebc00c779e36d56a8e99c",
      "size": 1421
    },
    {
      "path": "bin/uninstall.ps1",
      "sha256": "3ee45bbc80f8c41d236ebe58f9c65fe8229392657243d460892bf772303d3256",
      "size": 1143
    },
    {
      "path": "bin/uninstall.sh",
      "sha256": "d2ed13985e5537c4f037aa84dfe97d27328e45bacb21d681132fb166526a64dd",
      "size": 758
    },
    {
      "path": "docs/agent-native-workflow.md",
      "sha256": "34648c437c566681f3f4a4133adf6b7f8b259494988e05063c24a5c83c971a44",
      "size": 2902
    },
    {
      "path": "docs/application-workspace-management.md",
      "sha256": "5ca1727caf3be2c840cf57e441c5fe9c0d81d5c5e8ff4673df4ea3213a2b7c8d",
      "size": 2491
    },
    {
      "path": "docs/architecture-overview.md",
      "sha256": "3355e2223b137f9acd56db43d87d946fa313f07501845621b73740a8ba3436b0",
      "size": 1287
    },
    {